<?xml version="1.0" encoding="UTF-8"?>
<families xmlns="http://www.example.org/family-schema"
	xmlns:xsi="http://www.w3.org/2001/XMLSchema-instance"
	xsi:schemaLocation="http://www.example.org/family-schema family_schema.xsd">
	<family adress="CIS,Belarus,Minsk,N186">
		<mother>
			<name>Kate</name>
			<surname>Petrova</surname>
			<maiden-name>Ivanova</maiden-name>
			<age>31</age>
			<hobby>
				<title>Dancing</title>
				<times-per-week>2</times-per-week>
				<schedule>
					<day>monday</day>
					<time>18:00</time>
					<day>friday</day>
					<time>18:00</time>
				</schedule>
			</hobby>
		</mother>
		<father>
			<name>Igor</name>
			<surname>Petrov</surname>
			<age>31</age>
			<hobby>
				<title>Box</title>
				<times-per-week>2</times-per-week>
				<schedule>
					<day>monday</day>
					<time>18:00</time>
					<day>friday</day>
					<time>18:00</time>
				</schedule>
			</hobby>
		</father>
		<children>
			<child>
				<name>Ivan</name>
				<surname>Petrov</surname>
				<age>5</age>
				<gender>male</gender>
			</child>
			<child>
				<name>Olga</name>
				<surname>Petrova</surname>
				<age>6</age>
				<gender>female</gender>
			</child>
		</children>
	</family>
	<family adress="Belarus,Gomel,N1">
		<mother>
			<name>KateTwo</name>
			<surname>PetrovaTwo</surname>
			<maiden-name>IvanovaTwo</maiden-name>
			<age>31</age>
			<hobby>
				<title>DancingTwo</title>
				<times-per-week>2</times-per-week>
				<schedule>
					<day>mondayTwo</day>
					<time>18:00</time>
					<day>fridayTwo</day>
					<time>18:00</time>
				</schedule>
			</hobby>
		</mother>
		<father>
			<name>IgorTwo</name>
			<surname>PetrovTwo</surname>
			<age>31</age>
			<hobby>
				<title>Swimm</title>
				<times-per-week>2</times-per-week>
				<schedule>
					<day>monday</day>
					<time>18:00</time>
					<day>friday</day>
					<time>18:00</time>
				</schedule>
			</hobby>
		</father>
		<children>
			<child>
				<name>IvanTwo</name>
				<surname>PetrovTwo</surname>
				<age>5</age>
				<gender>male</gender>
			</child>
			<child>
				<name>OlgaTwo</name>
				<surname>PetrovaTwo</surname>
				<age>6</age>
				<gender>female</gender>
			</child>
		</children>
	</family>
</families>